{
  "schema_version": "field-content-2",
  "inventory_complete": true,
  "name": "Three Higgs doublets with Standard Model fermions",
  "paper_ids": [
    "P08"
  ],
  "gauge_factors": [
    {
      "id": "colour",
      "family": "A",
      "rank": 2
    },
    {
      "id": "weak",
      "family": "A",
      "rank": 1
    },
    {
      "id": "hypercharge",
      "family": "U1",
      "rank": 1
    }
  ],
  "matter": [
    {
      "label": "Q",
      "lorentz": {
        "dimension": 4,
        "scheme": "jL_jR",
        "irreps": [
          [
            "1/2",
            "0"
          ]
        ]
      },
      "reality": "none",
      "copies": 3,
      "gauge_representations": {
        "colour": {
          "dynkin": [
            1,
            0
          ]
        },
        "weak": {
          "dynkin": [
            1
          ]
        },
        "hypercharge": {
          "charge": "1"
        }
      }
    },
    {
      "label": "u^c",
      "lorentz": {
        "dimension": 4,
        "scheme": "jL_jR",
        "irreps": [
          [
            "1/2",
            "0"
          ]
        ]
      },
      "reality": "none",
      "copies": 3,
      "gauge_representations": {
        "colour": {
          "dynkin": [
            0,
            1
          ]
        },
        "weak": {
          "dynkin": [
            0
          ]
        },
        "hypercharge": {
          "charge": "-4"
        }
      }
    },
    {
      "label": "d^c",
      "lorentz": {
        "dimension": 4,
        "scheme": "jL_jR",
        "irreps": [
          [
            "1/2",
            "0"
          ]
        ]
      },
      "reality": "none",
      "copies": 3,
      "gauge_representations": {
        "colour": {
          "dynkin": [
            0,
            1
          ]
        },
        "weak": {
          "dynkin": [
            0
          ]
        },
        "hypercharge": {
          "charge": "2"
        }
      }
    },
    {
      "label": "L",
      "lorentz": {
        "dimension": 4,
        "scheme": "jL_jR",
        "irreps": [
          [
            "1/2",
            "0"
          ]
        ]
      },
      "reality": "none",
      "copies": 3,
      "gauge_representations": {
        "colour": {
          "dynkin": [
            0,
            0
          ]
        },
        "weak": {
          "dynkin": [
            1
          ]
        },
        "hypercharge": {
          "charge": "-3"
        }
      }
    },
    {
      "label": "e^c",
      "lorentz": {
        "dimension": 4,
        "scheme": "jL_jR",
        "irreps": [
          [
            "1/2",
            "0"
          ]
        ]
      },
      "reality": "none",
      "copies": 3,
      "gauge_representations": {
        "colour": {
          "dynkin": [
            0,
            0
          ]
        },
        "weak": {
          "dynkin": [
            0
          ]
        },
        "hypercharge": {
          "charge": "6"
        }
      }
    },
    {
      "label": "H",
      "lorentz": {
        "dimension": 4,
        "scheme": "jL_jR",
        "irreps": [
          [
            "0",
            "0"
          ]
        ]
      },
      "reality": "real_module",
      "copies": 3,
      "gauge_representations": {
        "colour": {
          "dynkin": [
            0,
            0
          ]
        },
        "weak": {
          "dynkin": [
            1
          ]
        },
        "hypercharge": {
          "charge": "3"
        }
      }
    }
  ]
}
