{
  "schema_version": "field-content-1",
  "inventory_complete": true,
  "name": "Five-dimensional Universal Extra Dimensions",
  "paper_ids": [
    "P41"
  ],
  "gauge_factors": [
    {
      "id": "colour",
      "family": "A",
      "rank": 2
    },
    {
      "id": "weak",
      "family": "A",
      "rank": 1
    },
    {
      "id": "hypercharge",
      "family": "U1",
      "rank": 1
    }
  ],
  "matter": [
    {
      "label": "Q",
      "lorentz": {
        "dimension": 5,
        "scheme": "B2_Dynkin",
        "irreps": [
          [
            0,
            1
          ]
        ]
      },
      "reality": "none",
      "copies": 3,
      "gauge_representations": {
        "colour": {
          "dynkin": [
            1,
            0
          ]
        },
        "weak": {
          "dynkin": [
            1
          ]
        },
        "hypercharge": {
          "charge": "1/6"
        }
      }
    },
    {
      "label": "U",
      "lorentz": {
        "dimension": 5,
        "scheme": "B2_Dynkin",
        "irreps": [
          [
            0,
            1
          ]
        ]
      },
      "reality": "none",
      "copies": 3,
      "gauge_representations": {
        "colour": {
          "dynkin": [
            1,
            0
          ]
        },
        "weak": {
          "dynkin": [
            0
          ]
        },
        "hypercharge": {
          "charge": "2/3"
        }
      }
    },
    {
      "label": "D",
      "lorentz": {
        "dimension": 5,
        "scheme": "B2_Dynkin",
        "irreps": [
          [
            0,
            1
          ]
        ]
      },
      "reality": "none",
      "copies": 3,
      "gauge_representations": {
        "colour": {
          "dynkin": [
            1,
            0
          ]
        },
        "weak": {
          "dynkin": [
            0
          ]
        },
        "hypercharge": {
          "charge": "-1/3"
        }
      }
    },
    {
      "label": "L",
      "lorentz": {
        "dimension": 5,
        "scheme": "B2_Dynkin",
        "irreps": [
          [
            0,
            1
          ]
        ]
      },
      "reality": "none",
      "copies": 3,
      "gauge_representations": {
        "colour": {
          "dynkin": [
            0,
            0
          ]
        },
        "weak": {
          "dynkin": [
            1
          ]
        },
        "hypercharge": {
          "charge": "-1/2"
        }
      }
    },
    {
      "label": "E",
      "lorentz": {
        "dimension": 5,
        "scheme": "B2_Dynkin",
        "irreps": [
          [
            0,
            1
          ]
        ]
      },
      "reality": "none",
      "copies": 3,
      "gauge_representations": {
        "colour": {
          "dynkin": [
            0,
            0
          ]
        },
        "weak": {
          "dynkin": [
            0
          ]
        },
        "hypercharge": {
          "charge": "-1"
        }
      }
    },
    {
      "label": "H",
      "lorentz": {
        "dimension": 5,
        "scheme": "B2_Dynkin",
        "irreps": [
          [
            0,
            0
          ]
        ]
      },
      "reality": "complex",
      "copies": 1,
      "gauge_representations": {
        "colour": {
          "dynkin": [
            0,
            0
          ]
        },
        "weak": {
          "dynkin": [
            1
          ]
        },
        "hypercharge": {
          "charge": "1/2"
        }
      }
    }
  ]
}

