{
  "schema_version": "field-content-1",
  "inventory_complete": true,
  "name": "SM plus Rtilde2 and three RH neutrinos",
  "paper_ids": [
    "P11"
  ],
  "gauge_factors": [
    {
      "id": "colour",
      "family": "A",
      "rank": 2
    },
    {
      "id": "weak",
      "family": "A",
      "rank": 1
    },
    {
      "id": "hypercharge",
      "family": "U1",
      "rank": 1
    }
  ],
  "matter": [
    {
      "label": "Q",
      "lorentz": {
        "dimension": 4,
        "scheme": "jL_jR",
        "irreps": [
          [
            "1/2",
            "0"
          ]
        ]
      },
      "reality": "none",
      "copies": 3,
      "gauge_representations": {
        "colour": {
          "dynkin": [
            1,
            0
          ]
        },
        "weak": {
          "dynkin": [
            1
          ]
        },
        "hypercharge": {
          "charge": "1/6"
        }
      }
    },
    {
      "label": "u^c",
      "lorentz": {
        "dimension": 4,
        "scheme": "jL_jR",
        "irreps": [
          [
            "1/2",
            "0"
          ]
        ]
      },
      "reality": "none",
      "copies": 3,
      "gauge_representations": {
        "colour": {
          "dynkin": [
            0,
            1
          ]
        },
        "weak": {
          "dynkin": [
            0
          ]
        },
        "hypercharge": {
          "charge": "-2/3"
        }
      }
    },
    {
      "label": "d^c",
      "lorentz": {
        "dimension": 4,
        "scheme": "jL_jR",
        "irreps": [
          [
            "1/2",
            "0"
          ]
        ]
      },
      "reality": "none",
      "copies": 3,
      "gauge_representations": {
        "colour": {
          "dynkin": [
            0,
            1
          ]
        },
        "weak": {
          "dynkin": [
            0
          ]
        },
        "hypercharge": {
          "charge": "1/3"
        }
      }
    },
    {
      "label": "L",
      "lorentz": {
        "dimension": 4,
        "scheme": "jL_jR",
        "irreps": [
          [
            "1/2",
            "0"
          ]
        ]
      },
      "reality": "none",
      "copies": 3,
      "gauge_representations": {
        "colour": {
          "dynkin": [
            0,
            0
          ]
        },
        "weak": {
          "dynkin": [
            1
          ]
        },
        "hypercharge": {
          "charge": "-1/2"
        }
      }
    },
    {
      "label": "e^c",
      "lorentz": {
        "dimension": 4,
        "scheme": "jL_jR",
        "irreps": [
          [
            "1/2",
            "0"
          ]
        ]
      },
      "reality": "none",
      "copies": 3,
      "gauge_representations": {
        "colour": {
          "dynkin": [
            0,
            0
          ]
        },
        "weak": {
          "dynkin": [
            0
          ]
        },
        "hypercharge": {
          "charge": "1"
        }
      }
    },
    {
      "label": "H",
      "lorentz": {
        "dimension": 4,
        "scheme": "jL_jR",
        "irreps": [
          [
            "0",
            "0"
          ]
        ]
      },
      "reality": "complex",
      "copies": 1,
      "gauge_representations": {
        "colour": {
          "dynkin": [
            0,
            0
          ]
        },
        "weak": {
          "dynkin": [
            1
          ]
        },
        "hypercharge": {
          "charge": "1/2"
        }
      }
    },
    {
      "label": "Rtilde2",
      "lorentz": {
        "dimension": 4,
        "scheme": "jL_jR",
        "irreps": [
          [
            "0",
            "0"
          ]
        ]
      },
      "reality": "complex",
      "copies": 1,
      "gauge_representations": {
        "colour": {
          "dynkin": [
            1,
            0
          ]
        },
        "weak": {
          "dynkin": [
            1
          ]
        },
        "hypercharge": {
          "charge": "1/6"
        }
      }
    },
    {
      "label": "nu_R",
      "lorentz": {
        "dimension": 4,
        "scheme": "jL_jR",
        "irreps": [
          [
            "0",
            "1/2"
          ]
        ]
      },
      "reality": "none",
      "copies": 3,
      "gauge_representations": {
        "colour": {
          "dynkin": [
            0,
            0
          ]
        },
        "weak": {
          "dynkin": [
            0
          ]
        },
        "hypercharge": {
          "charge": "0"
        }
      }
    }
  ]
}
