{
  "schema_version": "field-content-1",
  "inventory_complete": true,
  "paper_ids": [
    "P38"
  ],
  "name": "Fraternal twin Higgs linear realization",
  "gauge_factors": [
    {
      "id": "colour",
      "family": "A",
      "rank": 2
    },
    {
      "id": "weak",
      "family": "A",
      "rank": 1
    },
    {
      "id": "hypercharge",
      "family": "U1",
      "rank": 1
    },
    {
      "id": "twin_colour",
      "family": "A",
      "rank": 2
    },
    {
      "id": "twin_weak",
      "family": "A",
      "rank": 1
    }
  ],
  "matter": [
    {
      "label": "Q",
      "lorentz": {
        "dimension": 4,
        "scheme": "jL_jR",
        "irreps": [
          [
            "1/2",
            "0"
          ]
        ]
      },
      "reality": "none",
      "copies": 3,
      "gauge_representations": {
        "colour": {
          "dynkin": [
            1,
            0
          ]
        },
        "weak": {
          "dynkin": [
            1
          ]
        },
        "hypercharge": {
          "charge": "1/6"
        },
        "twin_colour": {
          "dynkin": [
            0,
            0
          ]
        },
        "twin_weak": {
          "dynkin": [
            0
          ]
        }
      }
    },
    {
      "label": "u^c",
      "lorentz": {
        "dimension": 4,
        "scheme": "jL_jR",
        "irreps": [
          [
            "1/2",
            "0"
          ]
        ]
      },
      "reality": "none",
      "copies": 3,
      "gauge_representations": {
        "colour": {
          "dynkin": [
            0,
            1
          ]
        },
        "weak": {
          "dynkin": [
            0
          ]
        },
        "hypercharge": {
          "charge": "-2/3"
        },
        "twin_colour": {
          "dynkin": [
            0,
            0
          ]
        },
        "twin_weak": {
          "dynkin": [
            0
          ]
        }
      }
    },
    {
      "label": "d^c",
      "lorentz": {
        "dimension": 4,
        "scheme": "jL_jR",
        "irreps": [
          [
            "1/2",
            "0"
          ]
        ]
      },
      "reality": "none",
      "copies": 3,
      "gauge_representations": {
        "colour": {
          "dynkin": [
            0,
            1
          ]
        },
        "weak": {
          "dynkin": [
            0
          ]
        },
        "hypercharge": {
          "charge": "1/3"
        },
        "twin_colour": {
          "dynkin": [
            0,
            0
          ]
        },
        "twin_weak": {
          "dynkin": [
            0
          ]
        }
      }
    },
    {
      "label": "L",
      "lorentz": {
        "dimension": 4,
        "scheme": "jL_jR",
        "irreps": [
          [
            "1/2",
            "0"
          ]
        ]
      },
      "reality": "none",
      "copies": 3,
      "gauge_representations": {
        "colour": {
          "dynkin": [
            0,
            0
          ]
        },
        "weak": {
          "dynkin": [
            1
          ]
        },
        "hypercharge": {
          "charge": "-1/2"
        },
        "twin_colour": {
          "dynkin": [
            0,
            0
          ]
        },
        "twin_weak": {
          "dynkin": [
            0
          ]
        }
      }
    },
    {
      "label": "e^c",
      "lorentz": {
        "dimension": 4,
        "scheme": "jL_jR",
        "irreps": [
          [
            "1/2",
            "0"
          ]
        ]
      },
      "reality": "none",
      "copies": 3,
      "gauge_representations": {
        "colour": {
          "dynkin": [
            0,
            0
          ]
        },
        "weak": {
          "dynkin": [
            0
          ]
        },
        "hypercharge": {
          "charge": "1"
        },
        "twin_colour": {
          "dynkin": [
            0,
            0
          ]
        },
        "twin_weak": {
          "dynkin": [
            0
          ]
        }
      }
    },
    {
      "label": "H",
      "lorentz": {
        "dimension": 4,
        "scheme": "jL_jR",
        "irreps": [
          [
            "0",
            "0"
          ]
        ]
      },
      "reality": "complex",
      "copies": 1,
      "gauge_representations": {
        "colour": {
          "dynkin": [
            0,
            0
          ]
        },
        "weak": {
          "dynkin": [
            1
          ]
        },
        "hypercharge": {
          "charge": "1/2"
        },
        "twin_colour": {
          "dynkin": [
            0,
            0
          ]
        },
        "twin_weak": {
          "dynkin": [
            0
          ]
        }
      }
    },
    {
      "label": "Qhat",
      "lorentz": {
        "dimension": 4,
        "scheme": "jL_jR",
        "irreps": [
          [
            "1/2",
            "0"
          ]
        ]
      },
      "reality": "none",
      "copies": 1,
      "gauge_representations": {
        "colour": {
          "dynkin": [
            0,
            0
          ]
        },
        "weak": {
          "dynkin": [
            0
          ]
        },
        "hypercharge": {
          "charge": "0"
        },
        "twin_colour": {
          "dynkin": [
            1,
            0
          ]
        },
        "twin_weak": {
          "dynkin": [
            1
          ]
        }
      }
    },
    {
      "label": "that_R",
      "lorentz": {
        "dimension": 4,
        "scheme": "jL_jR",
        "irreps": [
          [
            "0",
            "1/2"
          ]
        ]
      },
      "reality": "none",
      "copies": 1,
      "gauge_representations": {
        "colour": {
          "dynkin": [
            0,
            0
          ]
        },
        "weak": {
          "dynkin": [
            0
          ]
        },
        "hypercharge": {
          "charge": "0"
        },
        "twin_colour": {
          "dynkin": [
            1,
            0
          ]
        },
        "twin_weak": {
          "dynkin": [
            0
          ]
        }
      }
    },
    {
      "label": "bhat_R",
      "lorentz": {
        "dimension": 4,
        "scheme": "jL_jR",
        "irreps": [
          [
            "0",
            "1/2"
          ]
        ]
      },
      "reality": "none",
      "copies": 1,
      "gauge_representations": {
        "colour": {
          "dynkin": [
            0,
            0
          ]
        },
        "weak": {
          "dynkin": [
            0
          ]
        },
        "hypercharge": {
          "charge": "0"
        },
        "twin_colour": {
          "dynkin": [
            1,
            0
          ]
        },
        "twin_weak": {
          "dynkin": [
            0
          ]
        }
      }
    },
    {
      "label": "Lhat",
      "lorentz": {
        "dimension": 4,
        "scheme": "jL_jR",
        "irreps": [
          [
            "1/2",
            "0"
          ]
        ]
      },
      "reality": "none",
      "copies": 1,
      "gauge_representations": {
        "colour": {
          "dynkin": [
            0,
            0
          ]
        },
        "weak": {
          "dynkin": [
            0
          ]
        },
        "hypercharge": {
          "charge": "0"
        },
        "twin_colour": {
          "dynkin": [
            0,
            0
          ]
        },
        "twin_weak": {
          "dynkin": [
            1
          ]
        }
      }
    },
    {
      "label": "tauhat_R",
      "lorentz": {
        "dimension": 4,
        "scheme": "jL_jR",
        "irreps": [
          [
            "0",
            "1/2"
          ]
        ]
      },
      "reality": "none",
      "copies": 1,
      "gauge_representations": {
        "colour": {
          "dynkin": [
            0,
            0
          ]
        },
        "weak": {
          "dynkin": [
            0
          ]
        },
        "hypercharge": {
          "charge": "0"
        },
        "twin_colour": {
          "dynkin": [
            0,
            0
          ]
        },
        "twin_weak": {
          "dynkin": [
            0
          ]
        }
      }
    },
    {
      "label": "B",
      "lorentz": {
        "dimension": 4,
        "scheme": "jL_jR",
        "irreps": [
          [
            "0",
            "0"
          ]
        ]
      },
      "reality": "complex",
      "copies": 1,
      "gauge_representations": {
        "colour": {
          "dynkin": [
            0,
            0
          ]
        },
        "weak": {
          "dynkin": [
            0
          ]
        },
        "hypercharge": {
          "charge": "0"
        },
        "twin_colour": {
          "dynkin": [
            0,
            0
          ]
        },
        "twin_weak": {
          "dynkin": [
            1
          ]
        }
      }
    }
  ]
}

